porn? empty/1	unnatural? empty/1	lang correct? 0/1	text_show	id
			نوشتههای برچسب خورده با ازدواج با عشق: وقتی کسی را دوست دارید که دوستتان ندارد، چه باید بکنید؟ با اینکه ممکن است اولین واکنشتان به اصطلاح آویزان شدن و سعی در برقراری ارتباط باشد، اما بهترین راهکار این است که واقعیت را بپذیرید و سعی کنید آن فرد را فراموش کنید. “اگر ندیده بودمت، دوستت نمی...[ متن کامل] طرح گواهینامه ازدواج برای جوانان دم بخت رئیس سازمان جوانان استان تهران از صدور گواهینامه تخصصی «ازدواج» برای جوانان دم بخت خبر داد. این گواهینامه پس از گذراندن دورههای آموزشی پیش از ازدواج ارائه میشود.محسن زنگنه وعده داد که در آینده ازدواج جوانان مشروط به داشتن این گواهینامه شود....[ متن کامل] دوست داشتن و عشق ورزیدن الفبای سلامت روان به روایت دکتر مجد این مجموعه که به صورت کاملا اورجینال با پکیج اصلی تقدیم میگردد شامل ۲ عدد dvd تصویری میباشد. محتوای dvd ها در زیر آمده است. دوست داشتن و عشق ورزیدن ۱ مهربانی با مردم عشق برادرانه تفاوتهای دوست داشتن در مردان و زنان حسادت دلایل...[ متن کامل]	644d6c734d5f31664e4d98f92bca2964
			- خبر - سرگرمی - زناشویی - فرهنگ و هنر - دنیای مد - تصاویر - آشپزی - کامپیوتر و اینترنت - فیلم - کلیپ - موسیقی - علی پروین ممنوعالخروج شد - کفش جدید مسی برای آغاز فصل/ عکس - واکنش پروین به ممنوعالخروج شدنش - صادرات غیر نفتی سال جاری ۸.۱درصد - دولتی ها سراغ تفکرات سازمان مللی نروند - موافقتایران باافزایشعبور پروازهایاماراتی - درخواست ربیعی از وزیر کشور - فیسبوک مجبور به عذرخواهی شد - دلیل سفر مجدد کری به کابل - جزئیات تدوین قانون احزاب از زبان وزیر کشور - انگلیس سفارت خودرادرلیبی تعطیل می کند - ش .......... عهده داشت, مقابل درب منزل مسکونی, جنوب بیروت, هدف رگبار مسلسل جوخه های ترور رژیم صهیونیستی قرار گرفت, بال بال, ملائک گشود سلاح ایرانی محرم با قابلیت نواخت تیر 2500 گلوله در دقیقه، از 6 لوله بهره می گیرد و به نوعی می توان آن را تنها مسلسل گاتلینگ 12.7 میلی متری عملیاتی با 6 لوله در جهان به شمار آورد. مسلما ورود به خدمت این سلاح توان رزم نیروهای پیاده ارتش ایران را شدیدا افزایش داده و دست برتر را به آنها در هر گونه رویارویی احتمالی با نیروهای پیاده دشمن خواهد داد. ادامه مطلب تگ ها : سلاح, ایرانی, 	c245914580250bc8a6e9302abf239c2f
			طرفداری - انتقال تیبو کورتوا به رئال مادرید عنوان اصلی صفحه نخست روزنامهها را به خود اختصاص داده است. گاتزتا دلو اسپورت مصاحبه اختصاصی با کاپلو: اینتر، مودریچ در بالاترین سطح؛ او یکی از بهترینهای دنیاست اما مادرید مطمئنا در برابر فروشش مقاومت خواهد کرد ستاره کروات امروز با پرز ملاقات میکند؛ او میخواهد راهی نراتزوری شود یک ماه از حضور رونالدو در یووه گذشت سیلوا-سویا با 38 میلیون یورو بند خرید دائم کوریره دلو اسپورت رئيس فررو و آنالیز فوتبال کنونی؛ فوتبال دیوانگان ناپولی در کمپین نیست ناپل بلیطهای .......... فبک صرب هستند؛ هفتهای دیوانه وار که میتواند شامل پیانیچ و مارسلو هم شود مارکا بوسه آ اس کورتوا در برنابئو معارفه شد: حالا من هم یک مادریدیستای دیگر هستم کیلور؟ در چلسی هم پتر چک بود در سوپرکاپ اسپانیا از وار استفاده میشود یری مینا و گومز در اورتون موندو دپورتیوو یری مینا و آندره گومز به اورتون درآمد 124 میلیون یورویی بارسلونا از فروش بازیکنان رئال مادرید، کورتوا لوگو را بوسید اسپورت عملیات خروج و رکورد 124 میلیون یورویی اشاره به عملکرد فوق العاده بارسا در فروش بازیکنان مازادش در نقل و انتقالات ت	b06d0d0e6c488d5b4f7447c9ee26154b
			آموزش تكنیك های تست زنی در كنكور مهندسی معكوس یا Test Reverse Engineering + كتاب آموزشی در ادامه این مطلب می توانید نمونه سؤالات امتحانی ترمهای اخیر دانشگاه پیامنور دروس عمومی دانشگاه پیام نور را دانلود کنید قابل استفاده برای دانشجویان دانشگاه پیام نور ، داوطلبان دوره های فراگیر و داوطلبان آزمون کارشناسی ارشد سوال پیام نور آزمون پیام نور جزوه کامپیوتر جزوات پیام نور جزوات دوره كارشناسی ارشد نمونه سوالات پیام نور بانک سوال پیام نور نمونه سؤالات پایان ترم نمونه سوالات امتحانی دانلود نمونه سؤالات ت .......... انلود كم شود مشكلی نیست چند دقیقه بعد دوباره امتحان كنید حتما موفق خواهید شد اگر هم در پایان همین صفحه با ذكر ساعت این را بنویسید در حل مشكل كمك كرده اید - برای استفاده از این نمونه سوالات به نرم افزار كتاب خوان پی دی اف نیاز دارید در اینجا می توانید نرم افزاری كم حجم ، كامل و رایگان خواندن كتاب های الكترونیك و همچنین این نمونه سوالات را بگیرید - اگر می خواهید به كاملتر شدن این بانك سوال كمك كنید و نمونه سوالات یا پاسخ سوالات یا جزوه ای در اختیار دارید تردید نكید همین الان در آخر همین صفحه این ر	2139239f354af91d4b9e870c00854ead
			انتقال مهمانان با جت اختصاصی مراسم ازدواج موراتا، شنبه هفته آینده در ونیز برگزار میشود. پست جدید اسطوره... نام رائول گونسالس، به عنوان گزینه ریاست آکادمی رئال مطرح شده است. پسر کو ندارد نشان از پدر... پست جدید کریستیانو رونالدو مورد توجه هوادارانش قرار گرفت. عملکرد خیرهکننده کریس در فصل 17-2016 کریس رونالدو با عملکردی که در نیمفصل دوم فصل 17-2016 داشته به توپطلای پنجم بسیار نزدیک شده است. آبیاناریها چشم به فروش بودجه باشگاه بارسلونا برای حضور در نقلوانتقالات تابستانی مشخص شد. از فصل 19-2018... م .......... و خامس رودریگس از رئال مادرید، مسئولان رئال به دنبال یک بمب نقلوانتقالاتی هستند. در صورت انتقال به یونایتد... بر اساس ادعای رسانههای انگلیسی، آلوارو موراتا فصل آینده با ثبت یک رکورد، لباس منچستریونایتد را بر تن خواهد کرد. هدف اول والورده مشخص شد باشگاه بارسلونا قصد دارد 100 میلیون یورو برای جذب مارکو وراتی هزینه کند. درآمد چشمگیر کهکشانیها رئال مادرید با قهرمانی در لیگ قهرمانان اروپا، قیمت بازیهای دوستانهاش را افزایش داد. رونالدو تصمیم گرفت دو نوزاد دوقلوی آمریکایی که به روش لقاح مصنوعی متولد شد	fed36ebbedf22e6d74fb50448754c81e
			برای دانلود روی لینک زیر کلیک کنید ، در صورت بروز مشکل در دانلود حتما اطلاع دهید. با سلام حل تمرین آمار ریاضی پارسیان فصل تقدیم شما دانشجویان گرامی می شود حل تمرین آمار ریاضی پارسیان فصل پنج بقیه حل تمرین آمار ریاضی رو هم در این پست میذارم و برای خانم جانانی که از ما حل تمرین آمار ریاضی هوئل رو خواسته بودند عرض کنم که من هر چی گشتم نتونستم براتون پیدا کنم .هر کدوم از دوستان که لینکش رو داشته باشند و به ما بدن خوشحال میشیم بذاریم.البته شاید بتونم لینک متن خود کتاب رو پیدا کنم که فکر نکنم نیاز داشته باشین. دوستان این بارحل تمرین آمار ریاضی فصل ۷ رو میذارم البته خانم سروش مهر فصل ۹ و۱۰ رو هم برامون پیدا کردن که درصورت نیاز اونا رو هم میذارم	4ef525d84b3aa3254d1be56a1c7429a3
			بازیگری او در نه سالگی به عنوان مدل برای لباس های بچه گانه شروع بکار کرد و یک Foot Model1 هم شد. اولین نقش تلویزیونی او به عنوان بازیگر مهمان در سریال نسبتا ترسناک « آیا از تاریکی می ترسید؟» بود که برای بچه ها ساخته شده بود. بعدها در سری Forever Show به طور ثابت بازی کرد. او در مجموعه ی Popular Mechanics For Kids که در مونترال فیلم برداری شده بود هم حضور داشت. گزارش های او توجه هیلاری کلینتون را به خود جلب کرد که او را به دیدن کاخ سفید دعوت کرد. اولین نقش کاتبرت در یک فیلم بلند در درام خانوادگی  .......... تون و چاد مایکل در سال 2005 بود. کارکتر او و بقیه بازیگران طوری طراحی شده بود که نحیف و ناتوان به نظر بیایند. در یک صحنه کارکتر او سعی می کند دهانش را بازکند در حالیکه لبانش با چسب بسته شده است. با وجود تلاش کاتبرت برای ایفای نقش هرچه بهتر، این فیلم مورد انتقاد منتقدین قرار گرفت اما با این وجود در باکس آفیس فیلم موفقی محسوب می شد. 2006-2007 تحول در شغل پروژه ی بعدی او فیلم ایندی به نام خاموش بود که نه تنها در آن بازی می کرد بلکه در تهیه و تولید آن هم همکاری کرده بود. او نقش نینا دختر 17 ساله ی ت	1b54469be8cd26412c2f128ede3145bf
			اين شهر با موقعيت جغرافيائي بين مدار 37 درجه و 1 دقيقه تا 37 درجه 27 دقيقه عرض شمالي و مابين نصف النهار 48درجه ، 29دقيقه تا 48درجه ، 50دقيقه طول شرقي با وسعت 603.1251کيلومتر مربع بزرگترين شهر شمالي کشور بوده که حدود 9درصد وسعت استان گيلان را در برمي گيرد وسلسله جبال البرز در قسمت جنوبي شهررشت واقع شده و نزديک ترين قله بلند به شهر رشت ( درفک ) به ارتفاع 3500متر است. نزديک ترين شهرستان به رشت صومعه سرا است که در فاصله ي 26کيلومتر ي آن قرار دارد. رشت از جانب شمال به درياي خزر و مرداب انزلي ,از غرب به رودخانه پسيخان , صومعه سرا و فومن , از جنوب به شهرستان سنگر و رودبار و از شرق به کوچصفهان و لاهيجان محدود است و فاصله ي آن تا تهران 325کيلومتر و تا بندرانزلي 30کيلومتر است.	4493bfb1217c533ed48487b479d6b7c1
			photo make up بهترین کرم ضد چروک,جلوگیری از پیری پوست,سایت سیمرغ,سایت رزبلاگ,سایت کلوب,سایت مردمان,سایت زیبا شو,سایت تبیان,سایت بلا گفا,make up,eye linear,mascara,photo make up,بهترین مارک کرم ضد چروک, اموزش درست کردن سورمه بادام در خانه آموزش درست کردن سورمه در منزل برای داشتن بهترین آرایش چشم می توانید از سورمه استفاده کنید به شرطی که این سورمه ها کاملا بهداشتی باشند. به همین دلیل بهتر است سورمه را در منزل تان درست کنید. از آنجایی که سورمه بیشتر برای تقویت مژه و ابرو و زیبایی چشمها در اطراف چشم به کار برده می شود ، هم چنین عده ای از آن به جای مداد ابرو استفاده میکنند تا مانع ریزش ابروها شوند بنابراین سورمه باید کاملا اصل و بهداشتی باشد و گرنه عوارض جبران ناپذیری را به دنبال خواهد داشت. بهتر…	a4f43ac0ddbfb168303059f3d3506013
			سیاه...سفید...یک دنیا طرح ۲۶ﺁبان۱۳۸۲،روزنامه جام جم مدت هاست میان مردم هنر دوست ایران و هنرهای تجسمی فاصله ای قابل توجه افتاده است، فاصله ای که هر چه به عمر آن افزوده می شود، با حجم بیشتری از اطلاعات هنری، ایجاد و خلق طرحها و سبکهای جدید روبرو می شویم و متاسفانه عده قابل توجهی از بازدید کنندگان آثار هنری از باب سلیقه خود به آثار می نگرند و نه اصل و بنیان آنچه که پشتوانه تکنیکی هنری را به همراه خود دارد. طراحی آنچنانکه شناخته شده جزو اصلی ترین پایه های هر هنری به شمار می آید و چون کمتر به آن پردا .......... امد، شامل سالهای ۸۰ تا کنون است. حرکتهای قلم مهویس در این دوره از رهایی خاصی برخوردار است و نوعی ریتم موسیقی وار القاء می کند که در این مورد خود هنرمند نیز با این موضوع موافق است که در حین طراحی دوره سوم به موسیقی نیز گوش می سپرده و در فضایی که مدلهایش، فیگورهای طرحهایش بودند، جریان داشته و در یک نتیجه گیری کلی می توان گفت که در این دوره سفیدی کاغذ بیشتراز دوره قبل است. نکته بسیار مهمی که در آثار مهویس موج می زند نفوذ او به درون افکار و روح فیگورهاست. او به دنبال افق وسیعتری است. شاید در دیدی سه	ac4bc70355109cacb8a035838cdee5a7
			مالزی MALAYSIA نام رسمی: فدراسیون مالزی (شامل 13 استان و 3 منطقه فدرال) پایتخت: کوالالامپور ( منطقه فدرال؛ بزرگترین شهر با جمعیت 7 میلیون نفر) پایتخت اداری: پوتراجایا (منطقه فدرال) زبان رسمی: مالایی زبان دوم: انگلیسی اقوام: مالایی (54%) – چینی (25%) – هندی (7.5%) نوع دولت: مشروطه سلطنتی – فدرال نخست وزیر: نجیب تون رزاق استقلال از بریتانیا: 31 آگوست 1957 جمعیت: در حدود 29 میلیون نفر واحد پول: رینگیت MYR دامنه اینترنتی: my. ساعت: GMT+8 پیش شماره تلفن: 0060 کشور مالزیدر جنوب شرقى آسیا واقع شده و از .......... ى نفوذ زیادى پیدا کرد. بنیانگزار این سلطنت بعدها به دین اسلام گروید و نام خود را مگات اسکندرشاه گذاشت و دین اسلام را در قلمرو خود ترویج نمود. جانشین اسکندرشاه به نام مظفرشاه با کمک مسلمانان پس از فرونشاندن اغتشاشاتى که پیش آمده بود توانست تمام شبه جزیره مالایا و قسمتى از سوماترا را تسخیر کند و یک کشور کاملاً مهم از لحاظ تجارى و فرهنگى و کشاورزى در بین کشورهاى هند و چین بهوجود آورد. این دوره از تاریخ مالزىبه عصر طلائى مالایا مشهور است. با سقوط مالاکا، سلطان برونئى وظیفه گسترش اسلام را در منطقه به	e0d6750a32a1df7efb14a11b033cbf06
			حجت الاسلام هادی صادقی - معاون فرهنگی قوه قضاییه - امروز در نشست خبری از بیارتباط بودن اسیدپاشیهای اخیر در اصفهان با بحث "بیحجابی" و "امر به معروف و نهی از منکر" خبر داد و اعلام کرد: «اسیدپاشی ها در حوزه اختلافات شخصی بوده است، به عنوان مثال جوان عاشق پیشه جواب منفی می گیرد و دست به این کار می زند.» پیش از این نیز سردار اشتری، جانشین فرمانده نیروی انتظامی در همین خصوص عنوان کرده بود: «ارتباط اسیدپاشی ها با موضوع بدحجابی نبوده و این چنین نیست و افرادِ هدف متفاوت بودهاند و شکل و یا مورد خاصی مد نظ .......... تان از طریق زمینی و تبادلات کالا بین دو کشور و بمنظور رسیدگی به مسائل و مشکلات موجود در پایانه های مرزی نوردوز و مغری و مذاکره با مسئولسن استانداری آذربایجان شرقی، آقای محمد رئیسی سفیر جمهوری اسلامی ایران در ارمنستان با سفر به منطقه مذکور از تسهیلات و تاسیسات مرزی بازدید و امور مربوطه را طی جلساتی با مسئولین گمرکات و مرزبانی های دو کشور مورد بررسی قرار داد. علاوه بر مسائل مرزی، ایشان در سفر به تبریز و منطقه آزاد تجاری ارس، با استاندار آذربایجان شرقی، امام جمعه تبریز، شهردار و اتاق بازرگانی آن شه	d1cb221bd2feaa78bd09e90e9083090a
			با دیدن سخنان گُه هربار حاج شیخ علی خامنه ای، که گفته است: «آموزش علوم انسانى در دانشگاه ها منجر به ترويج شكاكيت و ترديد در مبانى دينى و اعتقادى خواهد شد»، به یاد سخنان حاج شیخ علی (یکی از شخصیت های رمان همسایه ها، اثر زنده یاد احمد محمود) افتادم! طنز روزگار اینکه هر دو هم حاج شیخ علی هستند! قسمتی از رمان را عینا برایتان می نویسم. بخوانید و شباهت های این دو شخصیت را ببینید. ... حاج شيخ علي به مخده لم مي دهد - اوسا حداد، خالد درس ميخونه؟ - بله آقا مدرسه ميره. حاج شيخ علي شربت بيدمشك را مزه مزه مي .......... ؟ پدرم مي گويد - از دولتي سر شما، كلاس چارمه آقا - حمد و سوره رو مي تونه بي غلط بخونه؟ - قربانت برم آيت الكرسي رو هم بي غلط مي خونه. حاج شيخ علي شربت بيدمشك را سر مي كشد و مي گويد. - خب، پس ديگه بسه. - يعني ديگه مدرسه نره؟ - اوسا حداد، مرد اونه كه وختي با پنجه بزني رو گرده ش، گرد و خاك بلند شه... مثه خودت، مؤمن و با خدا. پدرم جا به جا مي شود و باز مي گويد - يعني ميفرمايي كه... - بله اوسا حداد، درس زياد، آدمو سر به هوا مي كنه. ... چرا خامنه ای از شک کردن مردم هراس دارد! چون مطمئن است که مرحله پس 	25f4217eb97e8f4710e6134d2495ef5a
			امتحان امتحان لوک اويتنهاو مي گويد : امتحان دادن : احتمال اين هست که شغلي پر در آمدتر بيابيد قبول شدن در امتحان : انتظارات شما بر آورده خواهند شد مردود شدن در امتحان : جاه طلبي شما بالاتر از حد معمول است از کسي امتحان گرفتن : شما خدمت بزرگي به شخصي خواهيد کرد مولف گويد: چون امتحان همراه است با نگراني و اضطراب است مي توان بيننده خواب را به در گير بودن با مسائل ناراحت کننده و اضطراب انگيز تعبير نمود ولي اگر در خواب نسبت به امتحان هيچ نگراني و اضطراب نشان ندهد مي توان به آغاز يک موفقيت تعبير نمود ل .......... ايت مىگويد: اگر خواب ببينيد كه براى قبولى در دانشگاه امتحان مىدهيد، بيانگر پيروزى در مراحل مختلف زندگى است. اگر در خواب ببينيد كه در امتحان دانشگاه رد شدهايد، يعنى در امتحان موفق مىشويد. درکتاب سرزمين روياها آمده است : شما امتحان داريد : شايستگي شغلتان را نداريد . در امتحان موفق مي شويد : گرفتاري در كارها به سئوالات پاسخ صحيح مي دهيد : منفعت مالي به سئوالات پاسخ اشتباه مي دهيد : يك كارجالب و خبرهاي خوش بچه ها در امتحان موفق مي شوند : آرزوهاي شما برآورده مي شوند اشخاص ديگر در امتحان موفق مي شوند 	c66310ad0d63c8357424ecc3d5402351
			به گزارش ایسنا به نقل از مرکز رسیدگی به امور مساجد همزمان با شب میلاد امام زمان(عج) نوجوان ترین خادم مسجد لباس خادمی برتن کرد. براین اساس مسجد چهارده معصوم(ع) طی یک ابداع، اقدام به معرفی خادمی کردند که تنها ۱۳سال سن دارد و این اتفاق برای اولین بار در کشور رخ می دهد. در این خصوص حجتالاسلام والمسلمین مالک – امام جماعت مسجد و معاون فرهنگی باشگاه استقلال- گفت: در حدود یک ماه گذشته این طرح به ذهن بنده رسید که علاوه بر حرمین شریف که خادم افتخاری دارند برای مسجد هم میتوان خادم انتخاب کرد، از آنجایی که  .......... رس همیشه در مسجد حضور فعال و مفیدی را دارند. مالک در مورد فعالیت این خادم نوجوان یادآور شد: ایشان از امروز وظیفه دارند از زمان یک ساعت پیش از اذان تا یک ساعت بعد از نماز در مسجد حضور پیدا کنند و مردم را به سوی شبستانهای مسجد، سرویسهای بهداشتی، درمانگاه و حتی سالن همایش هدایت کنند، همچنین در صورت نیاز باید به سایر خدام نیز کمک کنند. وی در مورد شرایط مسجد چهارده معصوم(ع) و زمان تکمیل شدن آن نیز اظهار کرد: این مسجد توسط افراد خیر ساخته شده و هیچ ارگان یا دستگاهی تا به امروز به ما کمک نکردند، حتی سا	5caff897d1556b2baead2e60a9464f92
