porn? empty/1	unnatural? empty/1	lang correct? 0/1	text_show	id
		1	امکانات هتل آپارتمان معین درباری مشهد توضیحات هتل آپارتمان معین درباری مشهد هتل آپارتمان معین درباری یکی از مجموعه های اقامتی واقع در خیابان امام رضا مشهد و در فاصله 10 دقیقه پیاده روی تا ورودی باب الرضا ( ع ) حرم مطهر رضوی قرار دارد . پرسنل مجرب این مجموعه آمادگی دارند تا با خدمات غذایی فولبرد ( اقامت به همراه تمامی وعده های غذایی ) در خدمت زائرین امام هشتم باشند . این هتل در منطقه ای تجاری و در کنار بورس لوازم خانگی و ساعت مشهد واقع شده است و از این حیث برای مسافرینی که قصد خرید دارند قابل توج .......... رشب اقامت 290,000 تومان قیمت با تخفیف 20%=232,000تومان جهت رزرو تلفنی این مجموعه اقامتی با شماره 05132240005 تماس حاصل نمایید نام اتاق:آپارتمان سه خوابه شش تخته 22% تخفیف تعداد تخت : 6 تعداد نفرات مجاز : 10 قیمت هرشب اقامت 470,000 تومان قیمت با تخفیف 22%=366,600تومان جهت رزرو تلفنی این مجموعه اقامتی با شماره 05132240005 تماس حاصل نمایید کلمات کلیدی هتل آپارتمان معین درباری مشهد رزرو هتل آپارتمان معین درباری مشهد،تصاویر هتل آپارتمان معین درباری مشهد،قیمت هتل آپارتمان معین درباری مشهد،نرخ هتل آپار	e9c20fc2db95e8a064269d00b2386f60
	1	1	بازی پازلی اندروید - بازی آندروید یک موبایل دانلود نرم مرکز تخصصی موبایل اچ موبایل - اندرویدیها مرجع دانلود بازی و نرم Paradise Island 2 1 2 بازی استراتژیکی جزیره - یک موبایل دانلود نرم افزار برنامه سایت تخصصی دانلود موبایل - بازی اندروید دانلود کده دانلود آرشيو بازي هاي آندروید بر اساس موضوع - گيم آندرويد بازار بزرگ بازی های و بازی دانلود رایگان - موبایل بازی آندروید دانلود بازی کامپیوتری - بازی موبایل نرم افزار موبایل دانلود یاس دانلود دسته بازی فکری - دانلود دونی دانلود فیلم دانلود چهار شرطي  .......... ل اچ موبایل با توجه به استقبال شما دوستان عزیز از کتاب های ساخته شده در . . . اولین و بزرگترین مرجع دانلود نرم افزار و بازی برای سیستم عامل اندروید در ایران. Paradise Island 2 1 بازی جدید و فوق العاده زیبا و سرگرم کننده در سبک بازی های استراتژیک برای . . . مجموعه فوق کامل ترین مجموعه با موضوع کارت ویزیت و ست داری می باشد و از انجایی که اهمیت داشتن . بازی آرشيو بازي هاي آندروید بر اساس موضوع آپدیت شد تاریخ 90 04 14 برای راحتی کاربران و . . . گيم آندرويد بازار بزرگ بازی های و گیم دیتای آندروبد با 	10e4e43ebf7cd0a7894cfbb51a74c012
		1	کد خبر: ۴۱۱۳۰۸ تاریخ انتشار: ۲۱ خرداد ۱۳۹۶ - ۱۳:۳۵ پیشکسوت باشگاه استقلال می گوید ثبات در این باشگاه بهترین اتفاق بود و آبی ها می توانند مانند پرسپولیس با استفاده از این ثبات نتیجه بگیرند. مهدی پاشازاده در گفت و گو با سایت رسمی باشگاه استقلال، درباره شرایط این تیم در آستانه فصل جدید گفت: استقلال در مجموع فصل خوبیی را پشت سرگذاشت. اتفاقات خوب و مثبتی در فصل گذشته رخ داده که رضایت خواداران را هم در پی داشت و نباید با یک اتفاق فراموش شود. در فوتبال خیلی اتفاقات می افتد اما باید رو به جلو نگاه کرد ت .......... صل به استقلال آمد و هنوز کارش کامل نشده و نباید الان در باره او نظر بدهیم. باید به ایشان زمان کافی داد و پس از آن منتظر نتیجه بود. اتفاقی که در باشگاه پرسپولیس نیز رخ داد و این باشگاه نیز بعد از آن نتیجه گرفت. این که مدیر عامل و سرمربی استقلال اکنون با هم هماهنگ هستند، اتفاق قابل توجهی است که حفظ همین شرایط موضوع مهمی بود که انجام شد. پاشازاده در پایان تصریح کرد: هیاهو و شعار دادن در نقل و انتقالات کافی نیست. باید به دنبال بازیکنانی رفت که برای استقلال کارآمد هستند و می توانند اثر گذار باشند.نبا	af31fe25c624e28d387e0223ad7602b4
		1	یک فوق تخصص بیماریهای کبد و گوارش با بیان اینکه «چاقی به تنهایی میتواند زمینه ساز کبد چرب باشد»، تاکید کرد که شناخته شدهترین روش برای درمان کبد چرب ورزش همراه با کاهش وزن است و حتی دیده شده در بیمارانی که کاهش وزن نداشتهاند، ورزش نقش مهمی در بهبود کبد چرب را داشته است. دکتر شهرام آگاه درباره عارضه کبد چرب گفت:« مجموعهای از عوامل باعث رسوب مزمن چربی در کبد و التهاب و نارسایی مزمن در کبد میشوند و کبد چرب به دو گروه عمده تقسیم میشود؛ کبد چرب الکلی که ناشی از مصرف طولانی مدت الکل میباشد و جنسیت و نژ .......... به کبد چرب غیر الکلی میشود مثل اختلال در متابولیسم و برخی هپاتیتهای مزمن هم ممکن است همرا با کبد چرب دیده شود مثل هپاتیت Bو C.» دکتر آگاه یادآور شد:« آسیب مزمن کبدی در بیمارانی که کبد چرب آنها همراه با التهاب باقی بماند دیده نمیشود، اما در عده ای که کبد چرب آنها همراه با التهابات است باعث آسیب مزمن به کبد آنها میشود و در برخی بیماران التهابات می تواند پیش رونده بوده و منجر به سیروز کبدی در فرد شود که سیروز کبدی معمولا در افرادی که چاقی مفرط دارند دیده میشود و حتی در برخی موارد عامل سیروز کبدی نا	ffb173169484303bef47dd1de3add245
		1	آیت الله محمد علی موحدی کرمانی در خطبه های نماز جمعه این هفته تهران تصریح کرد: آمریکا می خواهد داعش را اداره کند و به دروغ می گوید که می خواهد آن را ریشه کن کند. آمریکا نمی خواهد داعش از بین برود امام جمعه موقت تهران با اشاره به جنایتهای داعش در منطقه و آوارگی مردم کشورهای سوریه و عراق گفت: امروز می بینید که مردم این کشورها خانه و کاشانه خود را به دلیل جنایتهای کثیف داعش رها میکنند. آیتالله موحدی کرمانی افزود: امریکا که ادعا می کند با ائتلاف برخی از کشورها می خواهد ریشه داعش را بکند دروغ می گوید .......... اشاره به سالروز فوت مرحوم طالقانی گفت: وی عالمی مبارز ، پرتلاش و مجاهد بود که هرگز زندگی و مشکلاتش در روح او خللی ایجاد نکرد. آیتالله موحدی کرمانی همچنین یاد آیت الله مدنی یکی از شهدای محراب را گرامی داشت. جنایت هفدهم شهریور هیچ گاه فراموش نمی شود وی همچنین به واقعه هفدهم شهریور اشاره کرد و افزود: این واقعه دو روی یک سکه بود، از یک طرف جنایت شاه بود که به امر امریکا صورت می گرفت، جنایتی که هیچ گاه فراموش نمی شود و طرف دیگر مقاومت مردم و شهادت طلبی آنان بود. خداوند بر روی زمین به کسانی که نعمت و 	67d680f23bfdfec24ae44cb4ff9975b4
	1	1	- خبر - سرگرمی - زناشویی - فرهنگ و هنر - دنیای مد - تصاویر - کاریکاتور و تصاویر طنز جدید - تصاویر متحرک جدید - عکس جدید - عکس های دیدنی و جالب جدید - آشپزی - کامپیوتر و اینترنت - فیلم - کلیپ - موسیقی - استخدام - آکهی های استخدام جدید - ابداع عینک هوشمند برای افراد کم بینا - طرز تهیه ته چین دو لایه - جدا کردن زرده از سفیده تخم مرغ - همسر رفیق بازتان را اینگونه مرد زندگی کنید - رشد جنین به چه عواملی بستگی دارد؟ - کارت پستال شهادت حضرت زهرا (س) - سری چهارم - بازی محلی جوجو يک منه - آمیتا باچان در ح ..........  ميخواستند ببينند يا بدانند حداقل منصفانه قضاوت ميكردند و منصفانه حرف ميزدند. جالب هم هست ... ادامه مطلب تگ ها : تابناک, تيم, مذاكرهكننده, هستهاي, طول, هفت, ماه, گذشته, معرض, نقد, بخشي, جريانهاي, سياسي, كشور, قرار, داشته, است, حجم, بالاي, سوالات, تذكرات, وزير, امور, خارجه, مجلس, اصولگرايان, نيز, نمونه, بارز, همين, مساله, روزنامه, اعتماد, نوشت, البته, نمايندگان, ميانهرو, برجسته, تلاش, هستند, توان, تحميل, فشار, ظريف, بكاهند, مسعود, پزشكيان, جمله, نمايندگاني, درست, نميداند, ميپردازد, ميگويد, منتقدا	87a4108aab5e034a6eb996696e7e04bf
		1	در سال ۱۹۹۶ منتقدها و سینماگرها و فیلم بین ها معتقد بودند متیو مكاناهی به خاطر شباهت ظاهری، رفتاری و بازیش، به زودی تبدیل به پل نیومن نسل جدید می شود.این پیش بینی از نظر اعتبار هنری درست از آب در نیامد؛ اما جایگاه او به عنوان یكی از ستاره های بی افول هالیوود امروز، چیزی كم از پل نیومن در دوران اوجش ندارد. متیو مكاناهی خیلی سریع در سینما رشد كرد و به ایفای نقش اصلی فیلم های مهم رسید.او كه در دوران دبیرستان می خواست وكیل بشود، در آستانه ورود به دانشگاه نظرش را عوض كرد و در رشته سینما وارد دانشگاه  .......... انیك» برایش مشكلی ایجاد نكرده و حتی خود او بازی در فیلم «شغال» را رد كرد.او در این سال با دو فیلم «تماس» و «آمیستاد» نشان داد كه موفقیتش اتفاقی نبوده و می تواند به اوج گیری ادامه بدهد. بعد از كارگردانی «یاغی» در سال ،۱۹۹۸ مكاناهی فعالیتش را روی حضور در فیلم های تجاری متمركز كرد و در انواع فیلم ها _ از كمدی و رمانتیك گرفته تا جنگی و فانتزی _ حاضر شد كه اكثر آنها هم با موفقیت تجاری همراه بودند.مهمترین فیلم های او در این دوره عبارت بودند از «اد تی وی»، «یو _ ۵۷۱»، «برنامه ریز عروسی»، «ضعف اخلاقی» «	c72440ea7f85b1ce47d9e3de55b85351
	1	1	- روستای میمند در استان کرمان - مجسمه هاي عجيب در جنگل - نقاشی های 3 بعدی خیابانی - سوتـی های جـالب، - طبیعت شگفت انگیز را تحسین کنیم - كـوتاه قـد ترین دختـر جـهان ! - سفر به ایرلند - قلعه ساخته شده از کاغذ - لحظه های خنده دار فوتبالی ! - صاعقه در گدازه هاي آتشفشانی - سفری رویایی در فضا پاتوباز کن راهنمای بازی hawx برای xbox360 سوباب دانلود البوم های گولبن ارگن دانلود بازی گوشی k600 دانلود آلبوم آسمان حمیدرضا نوربخش قصة ناكني دكتور سوالات اییننامه رانندگی پایه دوم اندی تولدت مبارک دانلود دانلود  .......... راغه خبرگزاري آريا - اولين کارگاه آموزشي هاديان سياسي نواحي بناب، عجبشير، ملکان، هشترود، چاروايماق در سپاه ناحيه مراغه برگزار مي شود. » کارگاه آموزشي هاديان سياسي در فاروج خبرگزاري آريا- کارگاه آموزشي هاديان سياسي با موضوع بصيرت افزايي هدفمند سازي يارانه ها در ناحيه مقاومت شهرستان فاروج با حضور سي نفر از هاديان برگزار شد. » برگزاري اردوي فرهنگي،معنوي در سپاه مهاباد خبرگزاري آريا - به همت روابط عمومي وتبليغات سپاه مهاباد،جمعي از کارکنان اين سپاه در اردوي فرهنگي،معنوي که در شهرستان مراغه ترتيب ياف	9f9f28b87ae536a5aba6946c877ca5c4
		1	- یکشنبه, آبان ۷, ۱۳۹۶, ۱۲:۲۰ - اخبار مسجدسلیمان, تازه ها, خبرها, ورزشی - 165 views باشگاه روزنامه نگاران مسجدسلیمان- سه کشتی گیر مسجدسلیمانی به اردوی تیم ملی دعوت شدند. عبدالله مرادی رییس هیئت کشتی شهرستان مسجدسلیمان در گفتگو با سایت خبری باشگاه روزنامه نگاران مسجدسلیمان با اعلام این خبر گفت: سید امیر رضا موسوی،آروین شیرمردی و علی شاه منصوری سه کشتی گیر مسجدسلیمانی هستند که به اردوی تیم ملی کشتی نونهالان جمهوری اسلامی ایران دعوت شدند. لازم به ذکر ... ادامه مطلب باشگاه روزنامه نگاران مسجدسلیمان- .......... ار مسجدسلیمان, تازه ها, خبرها, ورزشی - 69 views باشگاه روزنامه نگاران مسجدسلیمان- سرمربی تیم فوتبال نفت مسجدسلیمان با بیان اینکه باید تلاش بیشتری داشته باشیم تا فاصلهمان را با تیمهایی که در حال تعقیب ما هستند، بیشتر کنیم، گفت: توانایی بازیکنان من بیشتر از اینها است و امیدوارم در ادامه به آنچه مدنظرم است، دست پیدا کنیم. محمود فکری، در خصوص پیروزی یک بر صفر تیمش در هفته نهم لیگ ... ادامه مطلب - سه شنبه, مهر ۲۵, ۱۳۹۶, ۹:۲۸ - اخبار مسجدسلیمان, تازه ها, خبرها, ورزشی - 47 views باشگاه روزنامه نگاران م	f36d28f0e4382bfafd092705b8728182
		1	در خیابانهای اطراف بازار تهران چه گذشت جامعه > پلیس - مهر نوشت: تجمعات پراکنده امروز تهران که در برخی خیابان های منتهی به بازار تهران دیده می شد منجر به بروز ترافیک نسبتا سنگین در این مناطق شد که مشکلاتی را برای عبور و مرور مردم ایجاد کرد. به گزارش خبرنگاران مهر از سطح شهر تهران حاکی است که برخی مناطق تهران در حوالی بازار و مراکز خریدوفروش ارز و سکه از صبح امروز چهار شنبه وضعیت بی ثباتی داشته و برخی اعتراضات پراکنده باعث تعطیلی اصناف شده است. نیروهای امنیتی و انتظامی از ظهر امروز با حضور در این  .......... مناطق شد که مشکلاتی را برای عبور و مرور مردم ایجاد کرد. حضور نیروهای انتظامی در همه مناطق مرکزی تهران چشم گیر بود. همچنین امروز صبح تعدادی از اخلال گران بازار و دو تبعه یکی از کشورهای اروپایی که با ظاهر توریست در ناارامی های تهران مشغول جمع آوری اخبار بودند توسط نیروهای امنیتی بازداشت شدند. در همین رابطه سرهنگ خلیل هلالی ظهر امروز در خصوص تعطیلی بخشی از بازار تهران گفت: همیشه جمعیت شناوری در بازار حضور دارند . حضور چند نفر و تماشای اوضاع دلیل بر تجمع و تعطیلی نیست و خبری تاکنون در خصوص تعطیلی با	72855c7f793aaf41625d205a88851fb8
		1	وی گفت: با یک حساب سرانگشتی میتوان دریافت ایران تقریبا 8 برابر اروپا مصرف سرانه دارد. رئیس سازمان نظام مهندسی تهران با اشاره به اینکه این ارقام بسیار نگرانکننده است، افزود: میباید برنامههای فشرده و دقیقی برای کاهش این مصرف سرانه داشته باشیم. بیطرف گفت: تمامی ارگانها باید برای کاهش 150 واحدی مصرف سرانه به صورت پلهای عمل کنند و این مورد را در 5 مرتبه کاهش دهند. وی با اشاره به اینکه کاهش مصرفانرژی از زاویه بار اقتصادی نیز بسیار اهمیتدارد، تاکید داشت: برای کاهش این ارقام ظرفیتهای بالایی در کشور وجود .......... شترین قوانین کارآیی، بهرهوری و بهینه سازیمصرف انرژی را افزایش دهند. بیطرف گفت: درکنار اجرای دقیق قوانین فنی و اجرایی باید مبحث 19 به صورت کاملا دقیق اجرایی شود. رئیس سازمان نظام مهندسی تهران گفت: مهندسان طراح نیز میتوانند با رعایت اصول عایقبندی سقف، دیوار و کف ساختمان نقش مثبتی در کاهش مصرف انرژی داشته باشد. وی با بیان اینکه در کشور ما مصالح نوین با کیفیت تولید میشود خاطرنشان کرد: اگر کمکاری در بهکارگیری این مصالح نوین داریم مشکل را باید در بدنه اجرایی ساختمان ببینیم. بیطرف گفت: متاسفانه درد کنو	81b398214c5260d32c1465e84a1f9f9c
		1	مدیریت سایت با سلام ما در این سایت مافور برای شما عزیزان بخش های زیر رو قرار داده ایم در اینترنت بیشتر افراد دنبال مدل های لباس و مخصوصا خانوم ها دنبال مدل های مانتو ،مدل لباس مجلسی ،مدل کفش هستن که ما در بخش های انها را قرار داده ایم و در بخش های دیگر سایت میتوانید اس ام اس های جدید و جدیدترین اس ام اس های خنده دار را مشاهده کنید که امیدواریم مورد توجه شما باشد در دیگر بخش ها میتوانیم به اخبار زور و به مسائل قبل و بعد از ازدواج . مدل های آرایش و سلامتی تاکید کرد.توجه توجه به تازگی فروشگاه سایت  .......... الی را دوست داشته باشند! اگر چنین حالتی پیش بیاید باید گفت که یا عاشق زائد است یا معشوق. یکی کافی است. عشق، از خودخواهیها و خودپرستیها گذشتن است؛ اما این سخن به معنای تبدیل شدن به دیگری نیست. من از عشق زمینی حرف میزنم که ارزش آن در «حضور» است نه در محو و نابود شدن یکی در دیگری. عزیز من! اگر زاویه دیدمان نسبت به چیزی یکی نیست، بگذار یکی نباشد، بگذار فرق داشته باشیم، بگذار در عین وحدت مستقل باشیم. بخواه که در عین یکی بودن، یکی نباشیم، بخواه که همدیگر را کامل کنیم نه ناپدید. بگذار صبورانه و مهرمندا	b21dbf647c378ec78b21781f3bc0c255
	1	1	- منبع: جامعه باز - تاریخ نتشار: ۱۷ قوس ۱۳۹۴ - ساعت: ۱۰:۰۵ ق.ظ - کلینک کوتاه: شبکهها و سازمانهای تروریستی؛ طالبان (متن کامل) شبکهها و سازمانهای تروریستی؛ طالبان (متن کامل) نویسنده : ترجمۀ سلیم شفیق – کد خبر : ۳۹۵۱۴ ۱۷ قوس , ۱۳۹۴ ۱۴ سال پس از سقوط طالبان، این گروه دوباره بر سر زبانها افتاده است. تصور اینکه روزگاری این گروه از زیر آوار بمبهای خوشهای دوباره سر بر کند، دشوار بود. با این وجود، اکنون پس از صرف میلیاردها دالر و قربانیشدن هزاران سرباز و یک جنگ نسبتاً طولانی، این گروه نهتنها از میان بردا .......... اد که به گروه شورشی تبدیل شده، عنصر کوچک ولی مهم در شمالشرق افغانستان باقی ماندهاند. یک شورشگری تطابقپذیر؟ شورشگری طالبان افغان تلاش داشته تا گیراییاش را با ارائۀ یک تصویر دلپذیرتر گسترش دهد و ادعا کند که برخی از اصول بینالمللی را به رسمیت میشناسد. ملاعمر در ۲۰۰۶ حکم داد که فرماندهان محلی باید دربارۀ اجرای ممنوعیتهایی تصمیم بگیرد که حاکمیت گذشتۀ طالبان را ترسیم کند؛ مثلاً تلویزیون، موسیقی، آموزش و کار زنان باید اجازه داده شود و پیکارجویان زمینۀ کمپین واکسین فلج کودکان را تسهیل کنند. در همان سال،	e6e534538d00b1a3d0ad2fd4d599a6f4
	1	1	دانلود ادوب شوک ویو پلیر - دانلود ادوب شوک ویو پلیر ارم دانلود دانلود آخرین ورژن فلش پلیر Adobe Flash - ًٌ کد موزیک ًٌ دانلود اخرین نسخه هنرهای اسلامی بایگانی مذهبیون - Download Shockwave Player 12 0 2 122 دانلود رايگان دانلود عکس حضرت زینب بایگانی مذهبیون - مشکلات با فلش پلیر و شوک ویو پلیر چرا فلش پلیر دانلود نمیشه PersianTools Forums - فلش پلیر 11 فینال Flash Player 11 8 800 64 Beta هر آنچه پس از نصب یک سیستم عامل جدید - پلاگین پخش کلیپ و بازی فلش Adobe Shockwave دانلود ادوب ایر توپ دانلود l  .......... انگان The دانلود ادوب شوک ویو پلیر نمایش فیلم های فلش در . دانلود ادوب فلش پلیر 6 7 700 Flash Player Flash Player 11 آموزشي دانلود اخرين نسخه فلش پلير و شوک ويو پلير . - دانلود فلش پلیر برای ویندوز Adobe Flash تک دانلود متفاوت ترین دانلود سنتر راهنما Page Array سرزمین بازی ها مرکز Download Adobe Shockwave Player 11 6 4 634 SoftGozar com دانلود Adobe Flash Player نرم افزار موبایل آرتودوسافت دانلود نسخه نهایی فلش دانلود آخرین ورژن فلش پلیر Adobe Flash دانلود Windows Media Player v11 0 Final نسخه د	92c9a65d343ad6f63182baccab67e40e
