porn? empty/1	unnatural? empty/1	lang correct? 0/1	text_show	id
			- مجموعه: دکوراسیون و چیدمان بنا به در خواست شما کاربران گرامی مدل هایی زیبا از میز نهار خوری را گردآوری نمودیم امیدواریم مورد پسند شما واقع گردد. دکوراسیون, گالری عکس دکوراسیون, لوازم تزئینی, گالری عکس لوازم تزئینی, دکوراسیون داخلی, گالری عکس دکوراسیون داخلی, دکوراسیون منزل, گالری عکس دکوراسیون منزل, دکوراسیون اتاق, مدل میز نهار خوری, میز نهار خوری دکوراسیون, گالری عکس دکوراسیون, لوازم تزئینی, گالری عکس لوازم تزئینی, دکوراسیون داخلی, گالری عکس دکوراسیون داخلی, دکوراسیون منزل, گالری عکس دکوراسیون منزل, دکوراسیون اتاق, مدل میز نهار خوری, میز نهار خوری	9fc105d611e23b2b756c2f6ea6b32ade
			وب سایت (Utiran.ir) زیر نظر کارگروه (دانشگاه برتر ایران): متشکل از دانشجویان برتر و فارغ التحصیلان مجرب در زمینه های مختلف تلاش دارد در جهت بهبود و پیشرفت تحصیلی دانشجویان و دانش آموزان و دسترسی آسان این عزیزان به ( اخبار، جزوات، نمونه سوالات و … مدارس و دانشگاه) و برگزاری آزمون های آنلاین آمادگی کنکور، گام بلندی در توسعه الکترونیکی علمی کشور بردارد. لذا برای پیشرفت و توسعه کمی و کیفی سایت (Utiran.ir) نیازمند حمایت هرچه بیشتر دانشجویان و دانش آموزان گرامی می باشیم. تلفن: ( ساعت تماس ۱۰ الی ۱۹ ) - ۰۲۱-۲۸۴۲۲۹۱۰ ایمیل وب سایت ایمیل واحد پشتیبانی ایمیل واحد آزمون آنلاین سامانه پیامکی - ۵۰۰۰۱۰۶۰۱۵۴۹۸۵ تلگرام واحد پشتیبانی - utiranadmin@ (غیر فعال) - utiranadmin1@ (غیر فعال) فرم تماس با ما پرسنل ما در کمتر از ۲۴ ساعت به درخواست شما پاسخ خواهند داد. تمامی خدمات و فعالیت های سایت (Utiran.ir) تابع قوانین و مقررات جمهوری اسلامی ایران می باشد.	7d8f5c5f5c7aa54813916f63ea602494
			مدت زیادی اززمان ازدواجشان می گذشت وطبق معمول زندگی فرازونشی بهای خاص خودش راداشت . یک روززن که ازساعت های زیادکارشوهرعصبانی بودوهمه چیزراازهم پاشیده می دیدزبان به شکایت گشودوباعث ناامیدی شوهرش شد. مردپس ازیک هفته سکوت همسرش باکاغذوقلمی دردست به طرف اورفت وپیشنهادکردهرآنچه راکه باعث آزارشان می شودرابنویسند ودرموردآن هابحث وتبادل نظرکنند. زن که گله های بسیاری داشت بدون این که سرخودرابلندکندشروع کردبه نوشتن . مردپس ازنگاهی عمیق وطولانی به همسرنوشتن راآغازکرد. یک ربع بعدبانگاهی به یکدیگرکاغذهاراردوبدل کردند. مردبه زن عصبانی وکاغذلبریزازشکایت خیره ماند... امازن بادیدن کاغذشوهرخجالت زده شدوبه سرعت کاغذخودراپاره کرد. شوهرش درهردوصفحه این جمله راتکرارکرده بود: (دوستت دارم عزیزم)	44d29f2399d9293688259591376f30ac
			ستاد غنی سازی تره فرنگی در شمشیری دوباره فعال شد و بعد از این پست، بلافاصله این یکی پست رو روانه گیشه کرد. با تره فرنگی اضافه اومده از دوشنبه پیش این فریکاسی رو درست کردم. فریکاسی دیگر چیست؟ فریکاسی دیشی فرانسوی هست متشکل از گوشت پرندگان و پخته شده در سس سفید خامه ای. اینجا من کمی زرد کردم این غذا رو، اون هم با افزودن کاری! یادتون می یاد به ترکیب توپ کاری و ترخون اشاره کردم و به من خندیدید؟ در نتیجه من هم از رو نمی رم و این غذا رو با همون ترکیب ارائه می دم مواد لازم: چهار عدد بالارون مرغ نمک و فلفل به میزان لازم یک ساقه تره فرنگی، ریز خرد شده دو حبه سیر یک قاشق غذاخوری پودر کاری یک قاشق غذاخوری ترخون خشک دو پیمانه استاک مرغ یا آب معمولی نوک قاشق زعفران دو قاشق غذاخوری ترخون تازه ریز خرد شده	525abeb1366539a88af47ed51ca24297
			جمعه 7 شهريور 1393 ، ساعت 16:44 در دیدار اعضای شورای اداری با امام جمعه سبزوار: امام جمعه : مدیریت قوی می تواند معجزه کند امام جمعه سبزوار گفت: اگر مدیریتها قوی باشد می تواند معجزه کند لذا همگان باید برای حفظ نظام و انقلاب اسلامی تلاش کرده و مسوولیتهایی را که به ما واگذار شده به نحو احسن انجام دهیم. ادامه » معاون استاندار خراسان رضوی ارائه خدمت و پرهیز از نابرابری های اجتماعی از افتخارات نظام است فرماندار سبزوار در جمع مردم ششتمد گفت: نظام جمهوری اسلامی به رغم تمام محدودیت ها در ارائه خدمت به مر ..........  اطلاع رساني است و رابطه اي معنادار ميان قدرت اطلاع رساني حکومت ها با جايگاه آنها در جهان وجود دارد. سایر یادداشتها » ساير خبرها • کلنگ زنی و بهره برداری 13 طرح عمرانی و خدماتی در رودآب • یک مسوول: ارتقاء سلامت دانش آموزان نیازمند آموزش و فرهنگ سازی است • افتتاح مرکز راهنمایی و مشاوره خانواده آموزش و پرورش داورزن • مراسم اختتامیه کلاسهای اوقات فراغت آموزش و پرورش داورزن • شهرداری سبزوار همایش بزرگ فرزند پروری با رویکرد قرآنی را برگزار می کند • حضور خدام رضوی در سبزوار • برنامه های بنیاد شهید وام	d74e09bda6d969f4097ccc9c2d24733a
			Marlboro : بهترین سیگاری هست که تو ایران وجود داره ولی یه کم قیمتش بالاست و ۴ حالت داره: Marlboro Classic: دارای طعمی تندتر و دودی غلیظ تر و سنگین تر. Marlboro Medium:یه کم سبکتر از نوع Classic Marlboro Lights:سبکتر از دو مدل بالاست وحالتی ملایم دارد. Marlboro Menthol:دارای طعم نعنایی و خنک و بسیار ملایم. Camel :این سیگار بهترین سیگار جهان محسوب میشه وانواع مختلفی داره اما فقط دو نوعش تو ایران وجود داره: Camel Classic:رنگ پاکت این سیگار زرد است و مثل تمام سیگار های Classicکمی سنگین تر از انواع د .......... l:سیگار نسبتا سبکی است و پاکت های زیبایی دارد.۳نوع آن در ایران وجود دارد: Pall Mall Classic:که روش نوشته Full Flavour به معنی "طعم کامل" Pall Mall Lights :با پاکت سفید و آبی Pall Mall Ultra Lights:با پاکت سفید و خاکستری Kent:سیگاری است در حد متوسط و چهار نوع ازش در کشور وجود داره : kent Classic:با پاکت سفید و نوشته ی کنت به رنگ قرمز Kent Lights:با پاکت سفید و نوشته ی کنت به رنگ قرمز Kent Silver:با پاکت سفید و نوشته ی کنت به رنگ سرمه ای Kent Blue:با پاکت سفید و نوشته ی کنت به رنگ سرمه ای Magna:سی	c353cb621916eedf6712f3d39ba6af30
			بخش دوم و پاياني تليسه، مكالمه را براي خود انجام ميدهد. اين چنين مكالمه، تنها كار تليسه نيست، بلكه يك نشانة فرهنگي است كه همة زنان چنين مكالمة را انجام ميدهند. با آتش حرف زدن، نشاني از مجاورت زن و آتش است. زن در روستا هميشه كنار ديگدان است، ديگدان و آتش، مستلزم هم اند.√مخاطبهاي بيپاسخ در رمــــان «نقش شكار آهو» بخش نخست 1كساني كه در افغانستان به كار نقد ميپردازند، معمولاً به برون متن ميپردازند تا به درون متن. يا از خود و خاطرههاي خود ميگويند، يا از خاطرهيي كه نخستينبار با نويسنده يا با اولين اثر ..........  ميبافند. در اين مورد، مواضع سازمان كنفرانس اسلامي هم جالب توجه و قابل تأمل است. اين سازمان هم ضمن حمايت از روند آشتي با طالبان، از تمام نيروهاي مستقر در افغانستان درخواست آتش بس كرده، ولي معلوم نيست به چه دليل و يا دلايلي از طالبان نخواسته كه از حملات انتحاري و بمبگذاريهاي كنار جادهاي عليه اهداف غيرنظامي در كشور ما دست بردارند؟ به هر صورت، مواضع و سخنان آقايان اتمر و صالح هشداردهنده و برانگيزاننده بود و چه خوب است كه رهبران سياسي كشور به فرهنگ گفتگو و مباحثه تن ميدهند و آراي خود را با مردم شريك	59e1b79e32a88162effb5b0c29cddd60
			کمیته ویژه مشترک فراکسیونهای نمایندگان ولایی و امید برای تدوین برنامه جامع اقتصاد و معیشت مردم تشکیل میشود. به گزارش فارس قرار است در این کمیته ویژه 5 نفر از اعضای فراکسیون نمانیدگان ولایی و همچنین 5 نفر از اعضای فراکسیون امید به طور مستمر طی جلساتی با مقامات اقتصادی و کارشناسان به بحث و تبادل نظر پرداخته و نهایتا برنامه جامعی برای بخشهای مختلف اقتصادی کشور ارائه کنند. احتمالا اولین نشست کمیته ویژه مذکور سهشنبه هفته آینده و پس از تعیین اعضا برگزار خواهد شد. پیشتر خبرگزاری فارس طی خبری اعلام کرده بود که فراکسیون نمایندگان ولایی تدوین برنامه جامع اقتصاد و معیشت مردم را کلید زده است. به گفته حمیدرضا حاجیبابایی رئیس فراکسیون نمایندگان ولایی همکاری با سایر فراکسیونها و به کارگیری از ظرفیت فراکسیونهای مجلس از جمله فراکسیون امید برای تدوین برنامه جامع در دستور کار است.	df8eced51a50be749bd3d301a4ad1b55
			منطقه بی تفاوتی بارنارد: بارنارد درباره تصمیم گیری صحبت می کند و مطرح می کند که چرا برخی از تصمیم های مدیران را کارکنان اجرا می کنند و برخی دیگر را اجرا نمی کنند. وی اساسا به تصمیماتی که اجرا می شود نمی پردازد و تمرکز خود را بر عدم اجرای تصمیمات توسط کارکنان عطوف می کند. بارنارد بیان می کند که هنگامی تصمیمی اجرا می شود که به ناحیه بی تفاوتی افراد برخورد کند. ناحیه بی تفاوتی یعنی اجرای تصمیم تأثیر منفی بر سرنوشت کاری افراد مجری تصمیم نداشته باشد. به طور طبیعی اگر تصمیمی از ناحیه مدیر اتخاذ می شود و اجرا نمی شود، باید اذعان کرد که آن تصمیم بر ناحیه باتفاوتی افراد مجری برخورد کرده است و به نوعی با منافع و علایق آنها در تضاد قرار گرفته است. بارنارد معتقد بود که تحقق همکاری در سازمان و بقای آن به سه عامل بستگی دارد: 1. تمایل به خدمت ۲.هدف مشترک بارنارد معتقد بود سازمان مجموعه ای از سیستم های همکاری کننده به شرح زیر است: خرده سیستم زیستی؛ خرده سیستم شخصی؛خرده سیستم اجتماعی؛ خرده سیستم فیزیکی برچسبها: بی تفاوتی بارنارد , اصل بی تفاوتی , تئوری	4ccba8dcd6641f979e0920946cf202e4
			با سلام خدمت شما محقق محترم – شما با جستجوی ” گزارش کارآموزی زراعت و اصلاح نباتات در واحد حفظ نباتات اداره جهاد کشاورزی “ وارد این صفحه شده اید . مدیریت لینک سانا گزارش کارآموزی زراعت و اصلاح نباتات در واحد حفظ نباتات اداره جهاد کشاورزی دانلود گزارش کارآموزی …ادامه نوشته » کاملترین فایل پاورپوینت جنگل و عوامل مؤثر بر آن با سلام خدمت شما محقق محترم – شما با جستجوی ” پاورپوینت جنگل و عوامل مؤثر بر آن “ وارد این صفحه شده اید . مدیریت لینک سانا پاورپوینت جنگل و عوامل مؤثر بر آن دانلود پاورپوینت در م .......... ی “ وارد این صفحه شده اید . مدیریت لینک سانا تحقیق جهانگردی دانلود تحقیق در مورد جهانگردی، در قالب word و در ۱۹۳ صفحه، قابل ویرایش. بخشی از متن تحقیق: – مفاهيم و اشكال جهانگردي: جهانگردي Tourism، …ادامه نوشته » کاملترین فایل پاورپوینت شرکت صنایع غذایی نستله با سلام خدمت شما محقق محترم – شما با جستجوی ” پاورپوینت شرکت صنایع غذایی نستله “ وارد این صفحه شده اید . مدیریت لینک سانا پاورپوینت شرکت صنایع غذایی نستله دانلود پاورپوینت در مورد شرکت صنایع غذایی نستله، در قالب ppt و در ۱۸ اسلاید، قابل ویرای	9a62aa367ef5a217879ea3f883293e46
			کد خبر: ۵۳۵۸۷ تاریخ انتشار: ۱۹ بهمن ۱۳۹۲ - ۲۳:۰۲ پایگاه خبری تحلیلی روز نو (roozno.com): شبکه اسکای نیوز عربی از وخیم شدن اوضاع جسمانی مبارک در جلسه دادگاه وی خبر داد. به گزارش ایسنا، شبکه خبری اسکای نیوز عربی گزارش داد که اوضاع جسمانی حسنی مبارک، دیکتاتور سابق مصر در جلسه امروز (شنبه) وخیم شده و قاضی دادگاه مجبور شد جلسه را لغو کند. قرار بود امروز دادگاه کیفری شمال قاهره که در آکادمی پلیس برگزار شد، جلسات محرمانه خود را درخصوص مساله "محاکمه قرن" تکمیل کند که در آن حسنی مبارک و علاء و جمال مبارک .......... ن انقلاب 25 ژانویه و آشوبپراکنی در کشور و ایجاد خلاء امنیتی در کشور محاکمه شوند. به گزارش ایسنا، شبکه خبری اسکای نیوز عربی گزارش داد که اوضاع جسمانی حسنی مبارک، دیکتاتور سابق مصر در جلسه امروز (شنبه) وخیم شده و قاضی دادگاه مجبور شد جلسه را لغو کند. قرار بود امروز دادگاه کیفری شمال قاهره که در آکادمی پلیس برگزار شد، جلسات محرمانه خود را درخصوص مساله "محاکمه قرن" تکمیل کند که در آن حسنی مبارک و علاء و جمال مبارک، دو پسرش و حبیب العادلی، وزیر کشور اسبق مصر و شش تن از معاونان برجسته وی به اتهام تحری	fd2869e3390a9d1cd57e018bfaf9b773
			به گزارش ایسنا، به نقل از سایت اینترنتی النشره، این منبع با بیان این مطلب گفت: اظهارات رجب طیب اردوغان، رئیس جمهوری ترکیه پیرامون طرحهای روسیه برای ایجاد یک کشور کوچک در لاذقیه یاوه گویی محض است و مشخص است که تلاشی برای سوء استفاده از بحران در روابط با روسیه برای دور کردن توجهها از اقدامات ترکیه به عنوان کشوری که بیش از هر طرف دیگری در امور سوریه دخالت میکند، است. وی تصریح کرد: رهبری روسیه از آغاز بحران سوریه تاکید کرده است که سوریه باید کشوری دارای حاکمیت و دموکراتیک و سکولار و یکپارچه باقی بما .......... تر رجب طیب اردوغان، رئیس جمهور ترکیه، در سخنانی در جمع شماری از دیپلماتهای این کشور در آنکارا گفت: اقدامهایی که روسیه اخیرا در سوریه در حال انجام آن است، برای جهان مشکلآفرین شده است. به گزارش وبسایت رادیو تلویزیون دولتی ترکیه (TRT) اردوغان ادعا کرد: «روسیه هیچ گونه مبارزهای علیه داعش پیش نبرده بلکه برعکس در تلاش ساختن یک دولت کوچک در لاذقیه و اطراف آن است. مساله سرنگونی هواپیمای جنگی روسیه نیز در چنین فضایی بروز کرد.» اخبار بین الملل - ایسنا فروردین ۱۲, ۱۳۹۵ فروردین ۱۲, ۱۳۹۵ اسفند ۱۷, ۱۳۹۴ اسفند	f8647f7b47915b52deaef9a8e45991c4
			در این قسمت چند جمله ی تشویقی را که برای تشویق کودک می توان در زیر فعالیت او نوشت قرار دادم که امیدوارم مورد استفاده شما قرار بگیرد. 1- بارون دونه دونه کارت شده نمونه 2- دوستت دارم شقایق کودک خوب و لایق 3 - مورچه نوشت روی خاک قشنگ نوشتی و پاک 4- دختر (یا پسر ) خوب و نازم به دقتت می نازم 5- هم خندون و هم شاده دانش اون زیاده 6- درست خواندی تو قرآن ای کودک مسلمان 7- ای کودک بهشتی کامل و دقیق نوشتی 8- عقیده ی من اینه کودک خوب همینه 9- ماهی نوشت تو دریا آفرین و مرحبا 10- طیب طیب الله احسنت بارک الله ( جمله های تشویقی زیر ارسال شده توسط همکار گرامی خانم مهرآذین باسپاس از ایشان) 11- گل گل گل گل شقایق محترمه نزد همه شاگرد لایق 12-گل گل گل ،گله بهاره آستین رو بالا بزن که وقت کاره ( جمله های تشویقی زیر ارسال شده توسط دوست گرامی خانم مرسده باسپاس از ایشان) 13- آلبالوهای رنگی چه بچه زرنگی 14- اتل متل گلابی عجب بچه عالی موضوعات مرتبط: برچسبها: جملات تشویقی	e24ed5e84f7f3a33c823cb85a4dab3cc
			مسخره کردن گریه جواد ظریف در عزاداری امام حسین+عکس انتشار متن تمسخر آمیز خبرگزاری فارس همراه با تصویر ظریف در حین روضه امام حسین، باعث واکنش های مختلفی در فضای مجازی شده است. بسیاری از کاربران فضای مجازی با ارسال تصویر مذکور به یکدیگر، نسبت به این اقدام غیراخلاقی، واکنش نشان می دهند. روز گذشته کانال تلگرامی وابسته به خبرگزاری فارس، با انتشار تصویر ظریف در مجلس روضه امام حسین (ع)، نوشت: «جایزه صلح نوبل به رپیس جمهور کلمبیا رسید…+گفتم ما کجا و نوبل کجا شما چرا جدی گرفتین. منم چیم کمتر از یاسر عرفا .......... ه کجامیروید؟) سوره تکویر آیه ٢۶ در جلسات هیئت دولت کنار دکتر ظریف مینشینم؛ عکسی که مشاهده میفرمایید مربوط به جلسهای در ماه محرم سال گذشته است؛ لحظهای که حجتالاسلام و المسلمین روحانی از مظلومیت حسین ابن علی(ع) میگفتند و برادر عزیزم دکتر ظریف آرام میگریست. خداوند عاقبت همهی ما را ختم بهخیر کند. آیا این دین است؟ انتشار این تصویر اما با واکنش وزیر خارجه نیز همراه شد. محمد جواد ظریف در یک درد و دل خصوصی با برخی دوستانش، نسبت به انتشار این تصویر و متن تمسخر آمیز واکنش نشان داد. ظریف در این دلنوشته که 	eae0819ee13dcee6cbdc260f3234e194
			- جوشانيدن تا 30 درصد جذب كلسيم موجود در شير را كاهش ميدهد (0 replies) - با مصرف روزانه 2 ليوان شير نياز بدن به كلسيم و فسفر را تامين كنيد (0 replies) - تاثیر شير در جذب کلسيم و سلامت دندانها (0 replies) - سه ليوان دوغ معادل يك ليوان شير (0 replies) - چگونه می توان کلسیم مورد نیاز بدن را تأمین کرد (1 replies) - تأثير مصرف كلسيم در غذاي روزانه، بيشتر از مكملهاي دارويي است (2 replies) - مصرف مكمل كلسيم در سه ماهه سوم بارداري بر غلظت كلسيم در شير مادر تأثيري ندارد (0 replies) - مصرف كلسيم از ابتلاي ..........  از بروز شكستگيهاي استخواني ندارند (0 replies) - مکملهای کلسیمی در درمان پوکی استخوان (0 replies) - حتی با مصرف کلسیم نیز خطر پوکی استخوان کاملا برطرف نمی شود (0 replies) - یک مقام وزارت بهداشت:85 ميليون ايراني سوء تغذیه دارند (0 replies) - مصرف كلسيم از افزايش وزن زنان در ميانسالي جلوگيري ميكند (0 replies) - ۹۰/۵درصد مردم آذربايجان شرقي كمبود كلسيم دارند (0 replies) - کمک کلسیم به کاهش کلسترول طی رژیم های کاهش وزن (0 replies) - ۹۰ درصد خانوارهای ایرانی كمتر از حد نیاز كلسیم دریافت میكنند (0 rep	89e9ac2b373d89a652f93b9eacdcc551
