porn? empty/1	unnatural? empty/1	lang correct? 0/1	text_show	id
		1	خودداری برخی از فروشگاه ها از عرضه محصولات، افزایش قیمت بعضی از کالاهای مصرفی مردم همچنین جابه جایی و احتکار کالا توسط دلالان و واسطه ها در آستانه اجرای طرح هدفمندی یارانه ها مسئولیت مسئولان اجرایی، بازرسان و مراکز نظارتی را دوبرابر می کند. به گزارش خبرنگار ما طی روزهای اخیر شاهد تحرک دلالان و واسطه های در ارتباط با احتکار کالاهای مورد نیاز مردم هستیم که در این ارتباط خلأ مراکز نظارتی به خوبی محسوس است این کار در حالی صورت می گیرد که مسئولان اجرایی از مدتها قبل وعده داده بودند با گسترس نهادهای ن .......... کالاهای یارانه ای، نظارت جدی مجلس و کمیسیون ویژه بر این روند آغاز می شود. «کاظم دلخوش» درباره نحوه اجرای طرح هدفمندسازی یارانه ها و تبعات آن گفت، قانون تصویب شده مجلس بدون اشکال بوده و به قطع و یقین اثرات درازمدت مثبتی را نیز به دنبال خواهد داشت ولی نحوه اجرا مهم است و اگر قانون مصوب درست اجرا شود تبعات منفی آن کم خواهد بود. وی افزود: اجرای درست قانون می تواند بر افزایش درآمد اقشار مختلف تاثیر گذاشته و هزینه ها را نیز شفاف کند ولی این در صورتی است که اجرای این قانون نقصان نداشته باشد. نماینده مر	bc35fc163678c813639b7fd7e0c9e2ec
		1	براي ديدن مقاله قبلي اينجا کليک کنيد. اين جک رايان بود که به خاطر استعداد ويژه اش در شناخت فرم بدن زنان، لي لي را به چهره اي آنگلوساکسون تبديل نمود و سرانجام باربي را خلق کرد. دختر 20 ساله اي که پاهاي بلند و فيزيک بدني لاغري داشته و نمايشگر يک قد 195 سانتي متري است. بايد توجه داشت که اين ويژگي نمايشگر دوران جواني يک دختر است و از همين جا مي توان به الگوسازي باربي براي آينده کودکان به خوبي پي برد. طراحي چهره باربي به گونه اي اغراق گونه صورت گرفته که جامع اکثر زيبايي هاي متصور باشد و البته اين طرا .......... زمندي هاي دختران با تصوير، رنگ و تبليغ باربي در بازار کشورهاي مختلف از جمله کشور خودمان يافت مي شود. آنچنان که به گفته يکي از کارشناسان مي توان با هزينه ي حدود يک ميليون تومان، تمام مايحتاج يک دختر را که تبليغ کننده باربي باشد از بازار جمع آوري نمود، از لوازم التحرير گرفته تا لوازم بهداشتي- آرايشي، انواع لباس، کيف، کفش، خوردني هاي مورد علاقه ي کودکان و ... . فراگيري و فروش قابل توجه اين محصولات باعث رونق بيش از پيش اقتصادي اين عرصه گرديده و زمينه ي توليد آن با کيفيتهاي گوناگون و به منظور تامين س	be7b379da0f7701f4c0c3ee69cc2f8c3
		1	عضو هیئت علمی دانشگاه علم و صنعت گفت: از حرفهایی که برخی مسئولان و غربگرایان داخلی میزنند، برداشت می شود که وقت آن است که کشور را به سمت وابستگی به آمریکا ببرند و استقلال کشور را نابود کنند. عضو هیئت علمی دانشگاه علم و صنعت گفت: از حرفهایی که برخی مسئولان و غربگرایان داخلی میزنند، برداشت می شود که وقت آن است که کشور را به سمت وابستگی به آمریکا ببرند و استقلال کشور را نابود کنند. احمد چلداوی عضو هیئت علمی دانشگاه علم و صنعت در گفتوگو با خبرنگار سیاسی خبرگزاری تسنیم، با تاکید بر اینکه مسئله استقلا .......... ت. وی افزود: بعضی از دوقطبیسازیهایی که در کشور صورت میگیرد، به منظور سرگرم کردم مردم به حاشیهها و ایجاد شکافهایی است تا مسئله اصلی که همان “استقلال” است فراموش شود. به گفته این عضو هیئت علمی دانشگاه علم و صنعت، برخی مسئولان طی روزها و ماههای اخیر سخنانی را بر لب میرانند که گویا وقت آن است که کشور را به سمت وابستگی به آمریکا ببرند و استقلال کشور را نادیده بگیرند. چلداوی خاطرنشان کرد: هدف غرب و غربگرایان داخلی به تسلیم کشاندن کشور و کوتاه آمدن ما از شعارهای استراتژیک مان مانند حمایت از مظلومان و م	33d2d0e28e37d04058b9cc94519cff65
		1	قصه کراوات مجید از مجموعه داستان های هوشنگ مرادی کرمانی در مجله کریکت به چاپ رسید. مجله کریکت یکی از معتبرترین، پرتیراژترین و قدیمی ترین نشریات بین المللی کودکان و نوجوانان است که در سراسر دنیا فعالیت دارد. هوشنگ مرادی کرمانی با تایید این خبر گفت:« کریکت نام یک گروه از نشریات است که در زمینه های گوناگون فعالیت دارد مثلا همان طور که نشریه کیهان در ایران مجموعه ای است که بخش های ورزشی و کودکان و خانواده را در برمی گیرد نشریه کریکت نیز در شاخه های گونانگونی چون ورزشی، علمی، ادبی و البته بخش کودک و  ..........  طبل از مجموعه قصه های مجید از آن جمله بوده اند.» نشریه کریکت در سال 2002 ، سی امین سال تاسیس خود را جشن گرفت و به همین مناسبت مسابقه ای ترتیب داد که طی آن بهترین داستان کودک و نوجوان که در طول سی سال گذشته در این نشریه به چاپ رسیده انتخاب شود. در این مراسم هیات داوران جایزه سی امین سالگرد تاسیس کریکت و در راس آنان خانم "کاروس" با توجه به رای اکثریت داوران و مجموعه نامه های رسیده از سوی خوانندگان این نشریه داستان«طبل» اثر هوشنگ مرادی کرمانی را به عنوان داستان برگزیده از میان بهترین داستان های کو	145683fdfb40271a5918a20c0659ff16
		1	قذافی و امام موسی در 40 سال حکومت وی پس از به قدرت رسیدن، خود را مخالف صهیونیسم و امپریالیسم جهانی خواند و در میان کشورهای عربی به عنوان سرباز و مجاهد مخالف غرب مشهور شد او از دیرباز به لبنان به عنوان کشور آمال و آرزوهای خود مینگریست و داعیه مالکیت این کشور را در سر داشت. قذافی فعالانه در امور داخلی لبنان که تنها چند سال از استقلال آن نگذشته بود، دخالت میکرد و تلاش میکرد مسیحیان لبنان را از این کشور خارج کند و لبنان را به یک کشور سرتاسر مسلمان با حاکمیت اهل سنت تبدیل کند و این آغاز تفکری خطرناک  .......... انسه برای عیادت همسر بیمارش ترک کند. روز جمعه 25 اوت 1978 امام موسی صدر به اتفاق دو نفر از دستان صمیمیاش به نام شیخ محمد یعقوب و عباس بدرالدین رئیس خبرگزاری لبنان با یک فروند هواپیمای خطوط هوایی «الشرق الاوسط» از بیروت به طرابلس وارد شد و برخلاف انتظار، هیچ كدام از رسانههای لیبی این خبر را در آن روز مخابره نکردند و امام موسی صدر در سکوت خبری به لیبی وارد شد. بر پایه اسناد موجود امام صدر، آخرین بار در 31 اوت در طرابلس دیده شده است؛ بعدها یک شاهد لبنانی مقیم هتل اقامت امام موسی صدر فاش کرد که او د	20c642c89d4eaa82250c4569b9a910ba
		1	قابل توجه کارشناسان محترم عضو تعاونی مسکن کانون بدینوسیله به اطلاع میرساند که این تعاونی با شرکت در مزایده موفق به خرید دو قطعه زمین واقع در بوشهر – اراضی 530 هکتاری (پشت بیمارستان شهدای خلیج فارس) گردیده است. لذا از اعضاء محترم تعاونی که علاقمند به مشارکت در این پروژه می باشند ، دعوت بعمل می آید که تا تاریخ 93/3/31 نسبت به پرداخت مبلغ 225.000.000 ریال به حساب 1600/111/473948/1 بانک توسعه تعاون شعبه مرکزی بوشهر بنام تعاونی مسکن کانون کارشناسان رسمی دادگستری استان بوشهر اقدام نمایند. با توجه به اینکه تعداد واحدها محدود می باشد اولویت مشارکت در این پروژه براساس تاریخ فیش واریزی خواهد بود. در صورت تمایل سایر کارشناسان عضو کانون ، می توانند تا تاریخ فوق الذکر وجه مذکور را پرداخت نموده تا به عنوان عضو ذخیره ثبت گردند. بدیهی است در صورت به حد نصاب نرسیدن متقاضیان عضو تعاونی مسکن ، دیگر کارشناسان در پروژه شرکت داده خواهند شد. تعاونی مسکن کانون کارشناسان رسمی دادگستری بوشهر	85158fe68fd0641e2af89aa2389dd6d9
		1	وی آماده سازی مساجد از لحاظ امکانات، برخورد کریمانه با مردم، همکاری عوامل مسئول برای حضور بیشتر مردم در مساجد را از جمله عواملی تقویت این جلسات در مساجد برشمرد و افزود: هرمقداری که این محدویت ها بیشتر باشد، حضور مردم در مساجد کمتر می شود. با توجه به اینکه حضور مردم در ماه مبارک رمضان در مساجد بیش از دیگر زمان ها است، بنابراین باید مساجد بیش از گذشته باید جذابیت و پویایی لازم را برخوردار باشند. مدیرعامل اتحادیه موسسات قرآنی مردمی اظهار کرد: مسئولین مساجد باید افرادی که را به عنوان مسئول و هئیت ام .......... ی مسجد به منظور برگزاری جلسات قرآنی تاکید کرد و گفت: مسئولین مساجد نباید خودشان را صاحب مسجد و تصمیم گیر برنامه های آن بدانند، تا زمانی که چنین نگاهی به مساجد باشد و عده ای خود را تصمیم گیر بر برنامه های مساجد بدانند و ایمان سنج برای حضور مردم در مساجد داشته باشند، حضور مردم در خانه های خدا کمتر می شود. مدیرعامل اتحادیه موسسات قرآنی مردمی خاطر نشان کرد: برخی اذعان می کنند که هزینه های بالای تعرفه های مصرفی مساجد، در برخی مواقع موجب می شود که درب مساجد ساعات بیشتری بر روی مردم باز نباشد و فقط در 	00f78baa7910144a28d2ecd9fcf9dc63
	1	1	لیست شرکت ها در ایران , انواع رولبرینگ , سرامیک ضد اسید , عمده پوشاک , رطوبت مرغداری , فروش بالاست سولاریوم , WNE 29 , فروش بیشتر , Loading , توری پلاستیکی , مجری مستقیم تور استانبول , ارسال تبلیغات , خرید بلندگو , پرژکتور , رتبه 5 ساختمان , ،خرید , نمایندگی ویبروشیپ , ارسال حواله , کیفیت سنج های هوا و مایعات و گازها – ارت سنج ها, , تعمير ارت سنج , آرم نورانی , نمایندگی سامانه پیام کوتاه , آب سنج شیر , ویدئو دیتا پروژکتور , نمایندگی عینک قشم , بیل بکهو TDL100 تبریز , فروش ویندوز اورجینال , سازنده کارخانجات چرم مصنوعی , درباره ساندویچ پانل , , خط تولید , , کار , سودآوري بالا, , note , آرپیکو ، , اجرای موزیک زنده , قیمت همکاری , خدمات موسیقی , Etrex 30 جی پی اس دستی , ،کفپوش , اعلام حريق , (water jet) , لاغری , دستگاه بسته بندی خرما , جستجوی مستغلات , , مراکز آموزش عالی , نمایشگاه دستگاه فیلتر , محافل , کابل شبکه اوریجینال لگراند , 452 , مراکز خرید	b86ebd958f23792a621477c16a7626f5
		1	مولوی عبدالحمید به ایسنا گفت: از آقای رئیسی شناخت دیرینه داریم. سلامعلیک داریم. در انتخاباتی که ایشان برای مجلس خبرگان از بیرجند شرکت کردند، من هم به مردمم توصیه کردم به ایشان رای دهند؛ چرا که انسان موجهی است. {درباره نامه به رهبری}: موضوع آن نامه در رابطه با مشکلاتی بود که جامعه اهل سنت داشتند، مهم ترین مشکلاتشان تبعیض و نابرابری است، هم در استخدام نهادها، ارگان ها و ادارات مشکل دارند و هم در واگذاری مسئولیت و مناسب مشکل دارند. درخواست کردیم که ایشان فرمان تاریخی صادر کنند تا فرمان ایشان فصل ال .......... جناح پر قدرت اصولگرا و اصلاح طلب باید در خودشان تغییر ایجاد کنند. ما معتقد هستیم اصلاح طلبان هم باید در خود تغییر ایجاد کنند، اگر نه خود جناح اصلاحطلبی ضربه می خورد. {درباره حمایت از اقلیم کردستان}:صدام به کردهای عراق خیلی ظلم کرد. از حق و حقوقشان کم کرد، کشته دادند، بمباران شیمییایی شدند. من معتقدم که باید به این افراد بیشتر رسیدگی شود. دولت به آن ها بیشتر توجه کرده و مشکلاتان را با مذاکره حل کنند. به جنگ اعتقادی ندارم. من به مسئولان اقلیم کردستان و هم دولت مرکزی عراق توصیه می کنم که با هم بنشی	b221b6b9a04b4951389c382b61657136
		1	دانلود Angry Birds Seasons: Happy St. Patrick's Day! - بازی موبایل پرندگان عصبانی روز سنت پاتریک همانطور که همه می دانیم، هر فصل، فصل پرندگان عصبانی است و بقای پرندگان عصبانی در خطر است حتی در روز جشن سنت پاتریک! پس از نسخه جدید پرندگان عصبانی، ولنتاین، هالووین و کریسمس ، پرندگان عصبانی فصل به فصل به سمت روز جشن St. Patrick's می روند. در این بازی از قدرت های ویرانگر و بی همتای پرندگان عصبانی برای از بین بردن مخفیگاه خوک ها و کدو تبل های مزاحم در مراحل مختلف استفاده کنید و از خوک های سبزی که تخم های پرندگان را می دزدند انتقام بگیرید. در نظر داشته باشید که هر یک از این 348 مرحله نیاز به منطق، مهارت و نیروی بی رحم برای درهم شکستن دشمن دارد.	69b88e2a1e1e10fef4113542378c26b5
	1	1	- اینترنت رایگان و نامحدود ویژه تماشا و دانلود درون برنامهای فیلمها (ویژه مشترکین آسیاتک، ایرانسل، همراه اول و هایوب). نابخشوده zero tolerance جف (Jeff) یک مامور اف بی آی است که برای آوردن ری مانتا (Ray Manta)، یکی از اعضای کارتل مواد مخدر، از زندان مکزیک فرستاده می شود. مانتا فرار می کند، و با کشتن خانواده جف از او انتقام می گیرد. کو والسکی (Kowalski) یکی دیگر از ...... پیش نمایش، تصاویر و برش هایی از فیلم فیلم های مشابه بازیگران نابخشوده سایر عوامل فیلم نابخشوده فیلم نامه نویسJoe Hart دیدگاههای فیلم نابخشوده به دلیل رعایت حقوق ناشران، تمامی فیلمهای رایگان و اشتراکی فیلیمو فقط بر روی نرم افزار موبایل فیلیمو قابل دانلود است.	13263bca604c4cf8bc3585a67a266946
	1	1	تبلیغات موضوعات - اس ام اس - اس ام اس جک - اس ام اس چهارشنبه سوری - اس ام اس عاشقانه - اس ام اس خنده دار - اس ام اس دلتنگی - اس ام اس سرکاری - اس ام اس بوسه - اس ام اس تولد - اس ام اس تسلیت - اس ام اس زناشویی - اس ام اس تبریک - اس ام اس ضد دختر - اس ام اس ضد پسر - اس ام اس نفرت - اس ام اس خیانت - اس ام اس جدایی - اس ام اس دل شکستگی - اس ام اس فلسفی - اس ام اس مذهبی - اس ام اس سالگرد ازدواج - اس ام اس مناسبتی - اس ام اس رفاقتی - اس ام اس قهر و آشتی - اس ام اس شب بخیر - اس ام اس صبح بخیر - اس ام ا .......... گ! . . . . . دختر در حال راه رفتن… دوفففففففسک (زمین خوردن به دلیل نقص فنی در قسمت پاشنه کفش) رفیق دختر: آخ جیگرم خوبی؟ فدات شم! الهی بمیرم! چی شدی تو یهو؟ وااااااااااای… یک رهگذر: دخترم خوبی؟ فشارت افتاده؟ میخوای برسونمت دکتری جایی؟ یک پسر جوان رهگذر: ای وای خانوم حالتون خوبه؟ دستتونو بدین به من! من ماشینم همینجا پارکه یه لحظه وایسین،با این وضع که دیگه نمیتونین پیاده برین!!مطالب مرتبط : - خالی بندی های دخترونه (طنز) - پرسش های در مورد رانندگی خانم ها(طنز) - پ نه پ (طنز) - طنز خر عاشق - طنز دِ ن	ad9246ba72c9653d2705407148e984c4
		1	کیست که نداند رتق و فتق تمام وظایف قوهی مجریه به دست، و امضا و سیاست نامبرده عملی میشود و ای بسا که حسن روحانی هیچکاره باشد، به جز اینکه هر از چند روزی یک بار دلش هوای عشقش «برجام» بد فرجام و طنز مردمان داخل و خارج کشور را کرده، و برایش شعر قافیه تنگ آمده میگوید، و چند روزی سیاسیون و رسانهها را که مشکلات عامه مردم را ندارند، مشغول میسازد. ادامه ... به مناسبت 24 خرداد 1392 در 24 خرداد 1395 بسم الله الرحمن الرحیم خدا میداند که بنده طرفدار جناب آقای «روحانی» نبوده و رأی خود را به نام دیگری نوشتهام، .......... می، حسن روحانی مشهور به فریدون است. ضمن اینکه در ذهن اصلاحطلبان آنچنانی، دولت روحانی، «رحم اجارهای» است و در نزد وامداران جریان بدسابقه سازندگی، «روحانی»، به عنوان مجری دستورات هاشمیرفسنجانی معرفی میشود. چرا گفتیم که اسحق جهانگیریکوهشاهی اسم رسمی رئیس جمهور یازدهم است، نیازی به توضیح و تشریح ندارد. زیرا کیست که نداند رتق و فتق تمام وظایف قوهی مجریه به دست، و امضا و سیاست نامبرده عملی میشود، و ای بسا که حسن روحانی هیچکاره باشد، به جز اینکه هر چند روزی یک بار دلش هوای عشقش «برجام» بد فرجام، و طنز 	55936f16f7606d6cf986dc39839e4564
	1	1	برای تبادل لینک کلیک نمایید دانلود پیک نوروزی کلاس سوم دبستان دانلود پیک نوروزی کلاس سوم دبستان کره نرم شده: دو سوم پیمانه شکر: یک و یک چهارم پیمانه تخممرغ: دو عدد ماست ساده: نصف پیمانه آب پرتقال: نصف پیمانه پوست رنده شده پرتقال: یک قاشق غذاخوری آرد: دو و نیم پیمانه بیکینگپودر: نصف قاشق چایخوری جوششیرین: نصف قاشق چایخوری نمک: نصف قاشق چایخوری برای براق کردن: شکر قنادی: نصف پیمانه آب پرتقال: دو تا سه قاشق غذاخوری طرز تهیه: • فر را از قبل روی ۳۵۰ درجه سانتیگراد گرم کنید. • درون کاسهای بزرگ، کره و  .......... ق كف دست - فرمول رنگ پلاتینه - كرم موبر مردانه - غا های ایرانی - دانلودورژن ولترا - f2l - تعرفه آگهی در روزنامه های - پاسخنامه كنكور ارشد مديريت اجرايي ٨٩ - کتاب سی شارپ جعفر نژاد قمی - تم نوکیا 6303 کلاسیک - هاست رایگان با خدمات بالا - موتور سیکلت پالس 135 - جوک اس ام اس سرگرمی - والپيپر 5530 - قانون جدید ارث بین مادر از پسرش - آموزش شبكه كردن دو كامپوتر - نمونه كارهايي از سياه قلم - تولیدوپخش لوازم یدکی خودرو - دانلود رایگان شادمهر عقیلی حالم عوض میشه - ژل اصلاح - narcis dictionary 6 - اداب و 	53a3efcaaea706ccb5924063602876bb
	1	1	برچسب: فاصله بین دو بارداری بارداری باعث ایجاد تغییراتی در بدن مادر می شود که... بارداری اثرات بسیار مثبتی هم دارد ... نگرانی ها و سوالات بسیاری درباره اتفاقات طول دوران... بارداری وجود دارد از مشکلاتی که ممکن است برای مادر... و جنین ایجاد شود تا عوارض به تاخیر انداختن بارداری... نیاز است انجام شود بارداری بخش بسیار مهمی از زندگی... کد خبر: ۳۲۱۷۲ تاریخ انتشار: ۱۳۹۶/۰۶/۳۰ چرا 3 سال فاصله بررسی ها نشان می دهد وقتی... فاصله بین دو بارداری متوالی کمتر از 3 سال می... دهد وقتی بارداری های متوالی درست  ..........  مجدد است و اینکه مادر... و پدر هر دو باید تصمیم بگیرند که دومین فرزند... فاصله گذاری بین بچه ها داغ می شود ... رسد همه بدون استثنا خوشحال می شوند مادر هم که... این نگرانی ها ترس از بارداری مجدد است و اینکه... مادر و پدر هر دو باید تصمیم بگیرند که دومین... بحث فاصله گذاری بین بچه ها داغ می شود یک... کد خبر: ۱۲۱۰۲ تاریخ انتشار: ۱۳۹۵/۰۹/۲۹ بارداری خطرات بارداری های مکرر و با فاصله زمانی کوتاه برای... مادر گاهی سنگین و جبران ناپذیر است فاصله بین دو... بارداری برای سلامت مادر از اهمیت خاصی برخوردار 	d3a6006323b50443376974e4c10e2874
